<?xml version="1.0" encoding="UTF-8"?>
<cars
        xmlns="http://luksha.it-academy.by/xml/cars"
        xmlns:xsi="http://www.w3.org/2001/XMLSchema-instance"
        xsi:schemaLocation="http://luksha.it-academy.by/xml/cars cars.xsd">
    <car>
        <ID>1</ID>
        <Brand>Toyota</Brand>
        <Model>LC 200</Model>
        <Category>off-road</Category>
        <Cost>120</Cost>
        <Consumption>15.7</Consumption>
    </car>
    <car>
        <ID>2</ID>
        <Brand>Honda</Brand>
        <Model>Civic 5D</Model>
        <Category>economy</Category>
        <Cost>35</Cost>
        <Consumption>5.5</Consumption>
    </car>
    <car>
        <ID>3</ID>
        <Brand>BMW</Brand>
        <Model>7er</Model>
        <Category>business</Category>
        <Cost>70</Cost>
        <Consumption>12.5</Consumption>
    </car>
</cars>